{
  "schemaVersion": 1,
  "id": "ledger-demo",
  "epoch": 1,
  "events": [
    {
      "id": "listen-event-1",
      "mediaVersionID": "media-1",
      "epoch": 1,
      "range": {
        "startMs": 5000,
        "endMs": 70000
      },
      "eventKind": "played",
      "playbackRoute": "smartFeed"
    },
    {
      "id": "seek-event-2",
      "mediaVersionID": "media-2",
      "epoch": 1,
      "range": {
        "startMs": 25000,
        "endMs": 70000
      },
      "eventKind": "seek",
      "playbackRoute": "original"
    }
  ],
  "historyQuality": "recordedSinceSetup"
}
